{
  "$schema": "https://json-schema.org/draft/2020-12/schema",
  "$id": "https://verityspec.org/schemas/v0.1/unity/unity-package-dependency.schema.json",
  "title": "Unity Package Dependency",
  "type": "object",
  "additionalProperties": false,
  "required": [
    "id",
    "kind",
    "name",
    "status",
    "owner",
    "description",
    "packageName",
    "versionRequirement",
    "source",
    "purpose",
    "references"
  ],
  "properties": {
    "id": {
      "type": "string",
      "pattern": "^[a-z][a-z0-9]*(?:[._-][a-z0-9]+)*$"
    },
    "kind": {
      "type": "string",
      "const": "unity.package-dependency"
    },
    "name": {
      "type": "string",
      "minLength": 1
    },
    "description": {
      "type": "string",
      "minLength": 1
    },
    "status": {
      "type": "string",
      "enum": ["draft", "review", "ready", "deprecated", "removed"]
    },
    "owner": {
      "type": "string",
      "minLength": 1
    },
    "packageName": {
      "type": "string",
      "minLength": 1
    },
    "versionRequirement": {
      "type": "string",
      "minLength": 1
    },
    "source": {
      "type": "string",
      "enum": ["unity-registry", "git", "local", "asset-store", "embedded", "other"]
    },
    "purpose": {
      "type": "string",
      "minLength": 1
    },
    "requiredCapabilities": {
      "type": "array",
      "items": {
        "type": "string",
        "minLength": 1
      },
      "default": []
    },
    "references": {
      "type": "array",
      "items": {
        "type": "object",
        "additionalProperties": false,
        "required": ["type", "target"],
        "properties": {
          "type": {
            "type": "string",
            "minLength": 1
          },
          "target": {
            "type": "string",
            "minLength": 1
          },
          "required": {
            "type": "boolean",
            "default": true
          }
        }
      },
      "default": []
    }
  }
}
